"tech"	"callret-1"	"callret-2"	"callret-3"
"http://dbpedia.org/resource/Lessac_Technologies"	"Lessac Technologies"	"Natural language processing"	"Lessac Technologies, Inc. (LTI) is an American firm which develops voice synthesis software, licenses technology and sells synthesized novels as MP3 files. The firm currently has seven patents granted and three more pending for its automated methods of converting digital text into human-sounding speech, more accurately recognizing human speech and outputting the text representing the words and phrases of said speech, along with recognizing the speaker’s emotional state. The LTI technology is partly based on the work of the late Arthur Lessac, a Professor of Theater at the State University of New York and the creator of Lessac Kinesensic Training, and LTI has licensed exclusive rights to exploit Arthur Lessac's copyrighted works in the fields of speech synthesis and speech recognition. Based on the view that music is speech and speech is music, Lessac's work and books focused on body and speech energies and how they go together. Arthur Lessac's textual annotation system, which was originally developed to assist actors, singers, and orators in marking up scripts to prepare for performance, is adapted in LTI's speech synthesis system as the basic representation of the speech to be synthesized (Lessemes), in contrast to many other systems which use a phonetic representation. LTI’s software has two major components: (1) a linguistic front-end that converts plain text to a sequence of prosodic and phonosensory graphic symbols (Lessemes) based on Arthur Lessac's annotation system, which specify the speech units to be synthesized; (2) a signal-processing back-end that takes the Lessemes as acoustic data and produces human-sounding synthesized speech as output, using unit selection and concatenation. LTI’s text-to-speech system came in second in the world-wide Blizzard Challenge 2011 and 2012. The first-place team in 2011 also employed LTI's ""front-end"" technology, but with its own back-end. The Blizzard Challenge, conducted by the Language Technologies Institute of Carnegie Mellon University, was devised as a way to evaluate speech synthesis techniques by having different research groups build voices from the same voice-actor recordings, and comparing the results through listening tests. LTI was founded in 2000 by H. Donald Wilson (chairman), a lawyer, LexisNexis entrepreneur and business associate of Arthur Lessac; and Gary A. Marple (chief inventor), after Marple suggested that Arthur Lessac's kinesensic voice training might be applicable to computational linguistics. After Wilson’s death in 2006, his nephew John Reichenbach became the firm’s CEO."
"http://dbpedia.org/resource/MeaningCloud"	"MeaningCloud"	"Natural language processing"	"MeaningCloud, formerly known as Textalytics is a Software as a Service product that enables users to embed text analytics and semantic processing in any application or system -in an effective and inexpensive way. MeaningCloud extends the concept of semantic API with a cloud-based framework that makes the integration of semantic processing into any system something close to a plug-and-play experience. MeaningCloud is available both in SaaS mode and on-premises. In this way, developers and integrators can build solutions (e.g., media monitoring, voice of the customer analysis, content publishing) that leverage text analytics technologies applying a low risk, fast time-to-market approach, and using an inexpensive pay-per-use model."
"http://dbpedia.org/resource/Hybrid_machine_translation"	"Hybrid machine translation"	"Natural language processing"	"Hybrid machine translation is a method of machine translation that is characterized by the use of multiple machine translation approaches within a single machine translation system. The motivation for developing hybrid machine translation systems stems from the failure of any single technique to achieve a satisfactory level of accuracy. Many hybrid machine translation systems have been successful in improving the accuracy of the translations, and there are several popular machine translation systems which employ hybrid methods. Among these are PROMT, SYSTRAN and Omniscien Technologies (formerly Asia Online)."
"http://dbpedia.org/resource/Rule-based_machine_translation"	"Rule-based machine translation"	"Natural language processing"	"Rule-based machine translation (RBMT; ""Classical Approach"" of MT) is machine translation systems based on linguistic information about source and target languages basically retrieved from (unilingual, bilingual or multilingual) dictionaries and grammars covering the main semantic, morphological, and syntactic regularities of each language respectively. Having input sentences (in some source language), an RBMT system generates them to output sentences (in some target language) on the basis of morphological, syntactic, and semantic analysis of both the source and the target languages involved in a concrete translation task."
"http://dbpedia.org/resource/Content_determination"	"Content determination"	"Natural language processing"	"Content determination is the subtask of Natural language generation that involves deciding on the information to be communicated in a generated text. It is closely related to the task of Document structuring."
"http://dbpedia.org/resource/Automatic_acquisition_of_sense-tagged_corpora"	"Automatic acquisition of sense-tagged corpora"	"Natural language processing"	"The knowledge acquisition bottleneck is perhaps the major impediment to solving the word sense disambiguation (WSD) problem. Unsupervised learning methods rely on knowledge about word senses, which is barely formulated in dictionaries and lexical databases. Supervised learning methods depend heavily on the existence of manually annotated examples for every word sense, a requisite that can so far be met only for a handful of words for testing purposes, as it is done in the Senseval exercises."
"http://dbpedia.org/resource/Medical_intelligence_and_language_engineering_lab"	"Medical intelligence and language engineering lab"	"Natural language processing"	"The Medical Intelligence and Language Engineering laboratory, also known as MILE lab, is a research laboratory at the Indian Institute of Science, Bangalore under the Department of Electrical Engineering. The lab is known for its work on Image processing, online handwriting recognition, Text-To-Speech and Optical character recognition systems, all of which are focused mainly on documents and speech in Indian languages. The lab is headed by A. G. Ramakrishnan."
"http://dbpedia.org/resource/String_kernel"	"String kernel"	"Natural language processing"	"In machine learning and data mining, a string kernel is a kernel function that operates on strings, i.e. finite sequences of symbols that need not be of the same length. String kernels can be intuitively understood as functions measuring the similarity of pairs of strings: the more similar two strings a and b are, the higher the value of a string kernel K(a, b) will be. Using string kernels with kernelized learning algorithms such as support vector machines allow such algorithms to work with strings, without having to translate these to fixed-length, real-valued feature vectors. String kernels are used in domains where sequence data are to be clustered or classified, e.g. in text mining and gene analysis."
"http://dbpedia.org/resource/Automatic_taxonomy_construction"	"Automatic taxonomy construction"	"Natural language processing"	"Automatic taxonomy construction (ATC) is the use of autonomous or semi-autonomous software programs to create hierarchical outlines or taxonomical classifications from a body of texts (corpus). It is a branch of natural language processing, which in turn is a branch of artificial intelligence. ATC programs are examples of software agents and intelligent agents, and may be autonomous as well (see autonomous agent). Other names for ATC include taxonomy generation, taxonomy learning, taxonomy extraction, taxonomy building, and taxonomy induction. Any of these terms may be preceded by the word ""automatic"", as in automatic taxonomy induction. ATC is also referred to as semantic taxonomy induction. A taxonomy is a tree structure and includes familial (parent-offspring, sibling, etc.) relationships built-in (like in a family tree). For example, physics is an offspring of physical science, which in turn is an offspring of science. As mentioned above, the process is also called taxonomy induction. This is because, in order for a software program to construct a taxonomy from a corpus (for example, from Wikipedia, a web page, or the World Wide Web), it must induce which terms belong to the taxonomy and what the relationships between them are. Such as by identifying hyponym-hypernym pairs, among other approaches. This is done using algorithms, including statistical algorithms. Note that deduction (deductive logic) is often also employed (e.g., if B is a sibling of A, then B has the same parent as A and gets placed under that parent in the taxonomy). The primary application of automatic taxonomy construction is in ontology learning, a central activity within ontology engineering. In computer science and artificial intelligence, an ontology is a conceptual model of a (subject) domain. A domain is a given subject area or specifically defined sphere of interest. An ontology of a domain includes the vocabulary of that domain and the relationships between those concepts or entities. The backbone of most ontologies is a taxonomy, and taxonomical structure may be used throughout an ontology. As building taxonomies manually is extremely labor-intensive and time-consuming, there is great motivation to automate the process."
"http://dbpedia.org/resource/SemEval"	"SemEval"	"Natural language processing"	"SemEval (Semantic Evaluation) is an ongoing series of evaluations of computational semantic analysis systems; it evolved from the Senseval word sense evaluation series. The evaluations are intended to explore the nature of meaning in language. While meaning is intuitive to humans, transferring those intuitions to computational analysis has proved elusive. This series of evaluations is providing a mechanism to characterize in more precise terms exactly what is necessary to compute in meaning. As such, the evaluations provide an emergent mechanism to identify the problems and solutions for computations with meaning. These exercises have evolved to articulate more of the dimensions that are involved in our use of language. They began with apparently simple attempts to identify word senses computationally. They have evolved to investigate the interrelationships among the elements in a sentence (e.g., semantic role labeling), relations between sentences (e.g., coreference), and the nature of what we are saying (semantic relations and sentiment analysis). The purpose of the SemEval and Senseval exercises is to evaluate semantic analysis systems. ""Semantic Analysis"" refers to a formal analysis of meaning, and ""computational"" refer to approaches that in principle support effective implementation. The first three evaluations, Senseval-1 through Senseval-3, were focused on word sense disambiguation, each time growing in the number of languages offered in the tasks and in the number of participating teams. Beginning with the fourth workshop, SemEval-2007 (SemEval-1), the nature of the tasks evolved to include semantic analysis tasks outside of word sense disambiguation. Triggered by the conception of the *SEM conference, the SemEval community had decided to hold the evaluation workshops yearly in association with the *SEM conference. It was also the decision that not every evaluation task will be run every year, e.g. none of the WSD tasks were included in the SemEval-2012 workshop."
"http://dbpedia.org/resource/Semantic_analysis_(computational)"	"Semantic analysis (computational)"	"Natural language processing"	"Semantic analysis (computational) is a composite of the ""semantic analysis"" and the ""computational"" components. ""Semantic analysis"" refers to a formal analysis of meaning, and ""computational"" refer to approaches that in principle support effective implementation."
"http://dbpedia.org/resource/Sayre's_paradox"	"Sayre's paradox"	"Natural language processing"	"Sayre’s Paradox is a dilemma encountered in the design of automated handwriting recognition systems. A standard statement of the paradox is that a cursively written word cannot be recognized without being segmented and cannot be segmented without being recognized. The paradox was first articulated in a 1973 publication by Kenneth M. Sayre, after whom it was named."
"http://dbpedia.org/resource/Outline_of_natural_language_processing"	"Outline of natural language processing"	"Natural language processing"	"The following outline is provided as an overview of and topical guide to natural language processing: Natural language processing – computer activity in which computers are entailed to analyze, understand, alter, or generate natural language. This includes the automation of any or all linguistic forms, activities, or methods of communication, such as conversation, correspondence, reading, written composition, dictation, publishing, translation, lip reading, and so on. Natural language processing is also the name of the branch of computer science, artificial intelligence, and linguistics concerned with enabling computers to engage in communication using natural language(s) in all forms, including but not limited to speech, print, writing, and signing."
"http://dbpedia.org/resource/Semantic_compression"	"Semantic compression"	"Natural language processing"	"In natural language processing, semantic compression is a process of compacting a lexicon used to build a textual document (or a set of documents) by reducing language heterogeneity, while maintaining text semantics. As a result, the same ideas can be represented using a smaller set of words. Semantic compression is a lossy compression, that is, some data is being discarded, and an original document cannot be reconstructed in a reverse process."
"http://dbpedia.org/resource/Empirical_Methods_in_Natural_Language_Processing"	"Empirical Methods in Natural Language Processing"	"Natural language processing"	"Empirical Methods in Natural Language Processing or EMNLP is a leading conference in the area of Natural Language Processing. EMNLP is organized by the ACM special interest group on linguistic data (SIGDAT). EMNLP was started in 1996, based on an earlier conference series called Workshop on Very Large Corpora (WLVC). As of 2014, EMNLP has a field rating of 36 within computer science and a citation count of 6937, according to Microsoft Academic Search, both within the top-300 for the field of CS."
"http://dbpedia.org/resource/List_of_text_corpora"	"List of text corpora"	"Natural language processing"	"Following is a list of text corpora in various languages. ""Text corpora"" is the plural of ""text corpus"". A text corpus is a large and structured set of texts (nowadays usually electronically stored and processed). Text corpora are used to do statistical analysis and hypothesis testing, checking occurrences or validating linguistic rules within a specific language territory."
"http://dbpedia.org/resource/Lexical_simplification"	"Lexical simplification"	"Natural language processing"	"Lexical Simplification is a sub-task of text simplification. It can be defined as any lexical substitution task that reduce text complexity."
"http://dbpedia.org/resource/Semantic_folding"	"Semantic folding"	"Natural language processing"	"Semantic folding theory describes a procedure for encoding the semantics of natural language text in a semantically grounded binary representation. This approach provides a framework for modelling how language data is processed by the neocortex."
"http://dbpedia.org/resource/Text_graph"	"Text graph"	"Natural language processing"	"In natural language processing (NLP), a text graph is a graph representation of a text item (document, passage or sentence). It is typically created as a preprocessing step to support NLP tasks such as text condensationterm disambiguation(topic-based) text summarization, relation extraction  and textual entailment"
"http://dbpedia.org/resource/Manually_Annotated_Sub-Corpus_(MASC)"	"Manually Annotated Sub-Corpus (MASC)"	"Natural language processing"	"MASC is a balanced subset of 500K words of written texts and transcribed speech drawn primarily from the Open American National Corpus (OANC). The OANC is a 15 million word (and growing) corpus of American English produced since 1990, all of which is in the public domain or otherwise free of usage and redistribution restrictions. All of MASC includes manually validated annotations for logical structure (headings, sections, paragraphs, etc.), sentence boundaries, three different tokenizations with associated part of speech tags, shallow parse (noun and verb chunks), named entities (person, location, organization, date and time), and Penn Treebank syntax. Additional manually produced or validated annotations have been produced by the MASC project for portions of the sub-corpus, including full-text annotation for FrameNet frame elements and a 100K+ sentence corpus with WordNet 3.1 sense tags, of which one-tenth are also annotated for FrameNet frame elements. Annotations of all or portions of the sub-corpus for a wide variety of other linguistic phenomena have been contributed by other projects, including PropBank, TimeBank, MPQA opinion, and several others. Co-reference annotations and clause boundaries of the entire MASC corpus are scheduled to be released by the end of 2016. WordNet sense annotations for all occurrences of 114 words are also included in the MASC distribution, as well as FrameNet annotations for 50-100 occurrences of each of the 114 words. The sentences with WordNet and FrameNet annotations are also distributed as a part of the MASC Sentence Corpus."
"http://dbpedia.org/resource/Cloem"	"Cloem"	"Natural language processing"	"Cloem is a company based in Cannes, France, which applies natural language processing (NLP) technologies to assist patent applicants in creating variants of patent claims, called ""cloems"". According to the company, these ""computer-generated claims can be published to keep potential competitors from attempting to file adjacent patent claims."""
"http://dbpedia.org/resource/Rademacher_complexity"	"Rademacher complexity"	"Machine learning"	"In computational learning theory (machine learning and theory of computation), Rademacher complexity, named after Hans Rademacher, measures richness of a class of real-valued functions with respect to a probability distribution. Given a training sample , and a class of real-valued functions defined on a domain space , the empirical Rademacher complexity of is defined as: where are independent random variables drawn from the Rademacher distribution i.e. for . Let be a probability distribution over . The Rademacher complexity of the function class with respect to for sample size is: where the above expectation is taken over an identically independently distributed (i.i.d.) sample generated according to . One can show, for example, that there exists a constant , such that any class of -indicator functions with Vapnik-Chervonenkis dimension has Rademacher complexity upper-bounded by ."
"http://dbpedia.org/resource/Relational_data_mining"	"Relational data mining"	"Machine learning"	"Relational data mining is the data mining technique for relationaldatabases. Unlike traditional data mining algorithms, which look forpatterns in a single table (propositional patterns), relational data mining algorithms look for patterns among multiple tables(relational patterns). For most types of propositionalpatterns, there are corresponding relational patterns. For example,there are relational classification rules (relational classification), relational regression tree, and relational association rules. There are several approaches to relational data mining: 1.  
*  Inductive Logic Programming (ILP) 2.  
*  Statistical Relational Learning (SRL) 3.  
*  Graph Mining 4.  
*  Propositionalization 5.  
*  Multi-view learning"
"http://dbpedia.org/resource/CIML_community_portal"	"CIML community portal"	"Machine learning"	"The computational intelligence and machine learning (CIML) community portal is an international multi-university initiative. Its primary purpose is to help facilitate a virtual scientific community infrastructure for all those involved with, or interested in, computational intelligence and machine learning. This includes CIML research-,education, and application-oriented resources residing at the portal and others that are linked from the CIML site."
"http://dbpedia.org/resource/Granular_computing"	"Granular computing"	"Machine learning"	"Granular computing (GrC) is an emerging computing paradigm of information processing. It concerns the processing of complex information entities called information granules, which arise in the process of data abstraction and derivation of knowledge from information or data. Generally speaking, information granules are collections of entities that usually originate at the numeric level and are arranged together due to their similarity, functional or physical adjacency, indistinguishability, coherency, or the like. At present, granular computing is more a theoretical perspective than a coherent set of methods or principles. As a theoretical perspective, it encourages an approach to data that recognizes and exploits the knowledge present in data at various levels of resolution or scales. In this sense, it encompasses all methods which provide flexibility and adaptability in the resolution at which knowledge or information is extracted and represented."
"http://dbpedia.org/resource/Concept_learning"	"Concept learning"	"Machine learning"	"Concept learning, also known as category learning, concept attainment, and concept formation, is largely based on the works of the cognitive psychologist Jerome Bruner. Bruner, Goodnow, & Austin (1967) defined concept attainment (or concept learning) as ""the search for and listing of attributes that can be used to distinguish exemplars from non exemplars of various categories."" More simply put, concepts are the mental categories that help us classify objects, events, or ideas, building on the understanding that each object, event, or idea has a set of common relevant features. Thus, concept learning is a strategy which requires a learner to compare and contrast groups or categories that contain concept-relevant features with groups or categories that do not contain concept-relevant features. Concept learning also refers to a learning task in which a human or machine learner is trained to classify objects by being shown a set of example objects along with their class labels. The learner simplifies what has been observed by condensing it in the form of an example. This simplified version of what has been learned is then applied to future examples. Concept learning may be simple or complex because learning takes place over many areas. When a concept is difficult, it is less likely that the learner will be able to simplify, and therefore will be less likely to learn. Colloquially, the task is known as learning from examples. Most theories of concept learning are based on the storage of exemplars and avoid summarization or overt abstraction of any kind."
"http://dbpedia.org/resource/Prior_knowledge_for_pattern_recognition"	"Prior knowledge for pattern recognition"	"Machine learning"	"Pattern recognition is a very active field of research intimately bound to machine learning. Also known as classification or statistical classification, pattern recognition aims at building a classifier that can determine the class of an input pattern. This procedure, known as training, corresponds to learning an unknown decision function based only on a set of input-output pairs that form the training data (or training set). Nonetheless, in real world applications such as character recognition, a certain amount of information on the problem is usually known beforehand. The incorporation of this prior knowledge into the training is the key element that will allow an increase of performance in many applications."
"http://dbpedia.org/resource/Decision_list"	"Decision list"	"Machine learning"	"Decision lists are a representation for Boolean functions. Single term decision lists are more expressive than disjunctions and conjunctions; however, 1-term decision lists are less expressive than the general disjunctive normal form and the conjunctive normal form. The language specified by a k-length decision list includes as a subset the language specified by a k-depth decision tree. Learning decision lists can be used for attribute efficient learning."
