"tech"	"callret-1"	"callret-2"	"callret-3"
"http://dbpedia.org/resource/Eigenface"	"Eigenface"	"Face recognition"	"Eigenfaces is the name given to a set of eigenvectors when they are used in the computer vision problem of human face recognition. The approach of using eigenfaces for recognition was developed by Sirovich and Kirby (1987) and used by Matthew Turk and Alex Pentland in face classification. The eigenvectors are derived from the covariance matrix of the probability distribution over the high-dimensional vector space of face images. The eigenfaces themselves form a basis set of all images used to construct the covariance matrix. This produces dimension reduction by allowing the smaller set of basis images to represent the original training images. Classification can be achieved by comparing how faces are represented by the basis set."
"http://dbpedia.org/resource/Cross-race_effect"	"Cross-race effect"	"Face recognition"	"The cross-race effect (sometimes called cross-race bias, other-race bias or own-race bias) refers to the tendency to more easily recognize members of one's own race. A study was made which examined 271 real court cases. In photographic line-ups, 231 witnesses participated in cross-race versus same-race identification. In cross-race lineups, only 45% were correctly identified versus 60% for same-race identifications. In social psychology, the cross-race effect is described as the ""ingroup advantage"". In other fields, the effect can be seen as a specific form of the ""ingroup advantage"" since it is only applied in interracial or inter-ethnic situations, whereas ""ingroup advantage"" can refer to mono-ethnic situations as well. Deeper study of the cross-race effect has also demonstrated two types of processing for the recognition of faces: featural and holistic. It has been found that holistic processing (which occurs beyond individual parts of the face) is more commonly used in same-race situations, but there is an experience effect, which means that as a person gains more experience with those of a particular race, he or she will begin to use more holistic processing. Featural processing is much more commonly used with an unfamiliar stimulus or face."
"http://dbpedia.org/resource/Viola–Jones_object_detection_framework"	"Viola–Jones object detection framework"	"Face recognition"	"The Viola–Jones object detection framework is the first object detection framework to provide competitive object detection rates in real-time proposed in 2001 by Paul Viola and Michael Jones. Although it can be trained to detect a variety of object classes, it was motivated primarily by the problem of face detection. This algorithm is implemented in OpenCV as cvHaarDetectObjects()."
"http://dbpedia.org/resource/Iris_Challenge_Evaluation"	"Iris Challenge Evaluation"	"Face recognition"	"The Iris Challenge Evaluation (ICE) were a series of events conducted and managed by the National Institute of Standards and Technology for projects on technology development and evaluation for iris recognition. The ICE 2006 was the first large-scale, open, independent technology evaluation for iris recognition. The primary goals of the ICE projects were to promote the development and advancement of iris recognition technology and assess its state-of-the-art capability. The ICE projects were open to academia, industry and research institutes."
"http://dbpedia.org/resource/Thatcher_effect"	"Thatcher effect"	"Face recognition"	"The Thatcher effect or Thatcher illusion is a phenomenon where it becomes more difficult to detect local feature changes in an upside-down face, despite identical changes being obvious in an upright face. It is named after the former British Prime Minister Margaret Thatcher, on whose photograph the effect was first and most famously demonstrated. The effect was originally created in 1980 by Peter Thompson, Professor of Psychology at the University of York"
"http://dbpedia.org/resource/Face_hallucination"	"Face hallucination"	"Face recognition"	"Face hallucination refers to any superresolution technique which applies specifically to faces. It comprises techniques which take noisy or low-resolution facial images, and convert them into high-resolution images using knowledge about typical facial features. It can be applied in facial recognition systems for identifying faces faster and more effectively.Due to the potential applications in facial recognition systems, face hallucination has become an active area of research."
"http://dbpedia.org/resource/Coke_Zero_Facial_Profiler"	"Coke Zero Facial Profiler"	"Face recognition"	"Facial Profiler was a free Facebook app created to promote Coca-Cola Zero by the advertising agency Crispin Porter & Bogusky. The app used face recognition technology to search a database of voluntarily participating Facebook users  to match people based on appearance. The software's algorithm analyzed face attributes like skin color, face structure and angles of the face. Once matched, users could contact their look-alike via their Facebook profile. Coke Zero claimed the inspiration for Facial Profiler came from the drink itself. The tagline for the project was: ""If Coke Zero has Coke's taste, is it possible someone out there has your face?"""
"http://dbpedia.org/resource/Polar_Rose_(facial_recognition)"	"Polar Rose (facial recognition)"	"Face recognition"	"Polar Rose was a company from Malmö, Sweden which made facial recognition software. Polar Rose had a service that allows users to name people in their photos on photo sharing sites like Flickr and 23hq.com using their Facebook contacts. Using their facial recognition Polar Rose applied auto-tagging for users. The service was discontinued on 6 September 2010 only to be purchased two weeks later by Apple Inc. for approximately $29 million. The Polar Rose website and related add-ons for Firefox and Internet Explorer allowed users to put names to the faces of people whose photographs appear on the web, and to then find other pictures of the same individuals; however, as of May 20, 2009, use of the plugins was discontinued in favor of a purely web-based interface. Search Wikia featured integration with Polar Rose. Polar Rose founder Jan Erik Solem was company CTO while Danish serial entrepreneur Nikolaj Nyholm is CEO. Polar Rose was awarded a World Economic Forum Technology Pioneer Award in 2008  and has won other awards like SIME's 2007 Best Technical Innovation and the Red Herring Global 100 list for 2007."
"http://dbpedia.org/resource/L-1_Identity_Solutions"	"L-1 Identity Solutions"	"Face recognition"	"L-1 Identity Solutions, Inc. is a large American defense contractor in Connecticut. It was formed on August 29, 2006, from a merger of Viisage Technology, Inc. and Identix Incorporated. It specializes in selling face recognition systems, electronic passports such as Fly Clear, and other biometric technology to governments such as the United States and Saudi Arabia. It also licenses technology to other companies internationally, including China. On July 26, 2011, Safran (NYSE Euronext Paris: SAF) acquired L-1 Identity Solutions, Inc. for a total cash amount of USD 1.09 billion.|author=Business Wire |date=20010  L-1 is now part of Morpho's MorphoTrust department. Bioscrypt is a biometrics research, development and manufacturing company purchased by L-1 Identity Solutions. It provides fingerprint IP readers for physical access control systems, Facial recognition system readers for contactless access control authentication and OEM fingerprint modules for embedded applications. According to IMS Research, Bioscrypt has been the world market leader in biometric access control for enterprises (since 2006) with a worldwide market share of over 13%. In 2011, Bioscrypt was sold to Safran Morpho."
"http://dbpedia.org/resource/FERET_database"	"FERET database"	"Face recognition"	"The FERET database is a standard dataset used for facial recognition system evaluation. The Face Recognition Technology (FERET) program is managed by the Defense Advanced Research Projects Agency (DARPA) and the National Institute of Standards and Technology (NIST). A database of facial imagery was collected between December 1993 and August 1996. In 2003 DARPA released a high-resolution, 24-bit color version of these images. The dataset tested includes 2,413 still facial images, representing 856 individuals. The FERET program was set out to establish a large database of facial images that was gathered independently from the algorithm developers. Dr. Harry Wechsler at George Mason University was selected to direct the collection of this database. The database collection was a collaborative effort between Dr. Wechsler and Dr. Phillips."
"http://dbpedia.org/resource/E-FIT"	"E-FIT"	"Face recognition"	"Electronic Facial Identification Technique (E-FIT, e-fit, efit) is a computer-based method of producing facial composites of wanted criminals, based on eyewitness descriptions."
"http://dbpedia.org/resource/Face_perception"	"Face perception"	"Face recognition"	"Face perception is an individual's understanding and interpretation of the face, particularly the human face, especially in relation to the associated information processing in the brain. The proportions and expressions of the human face are important to identify origin, emotional tendencies, health qualities, and some social information. From birth, faces are important in the individual's social interaction. Face perceptions are very complex as the recognition of facial expressions involves extensive and diverse areas in the brain. Sometimes, damaged parts of the brain can cause specific impairments in understanding faces or prosopagnosia."
"http://dbpedia.org/resource/Prosopagnosia"	"Prosopagnosia"	"Face recognition"	"Prosopagnosia /ˌprɑːsəpæɡˈnoʊʒə/ (Greek: ""prosopon"" = ""face"", ""agnosia"" = ""not knowing""), also called face blindness, is a cognitive disorder of face perception where the ability to recognize familiar faces, including one's own face (self-recognition), is impaired, while other aspects of visual processing (e.g., object discrimination) and intellectual functioning (e.g., decision making) remain intact. The term originally referred to a condition following acute brain damage (acquired prosopagnosia), but a congenital or developmental form of the disorder also exists, which may affect up to 2.5% of the population. The specific brain area usually associated with prosopagnosia is the fusiform gyrus, which activates specifically in response to faces. The functionality of the fusiform gyrus allows most people to recognize faces in more detail than they do similarly complex inanimate objects. For those with prosopagnosia, the new method for recognizing faces depends on the less-sensitive object recognition system. The right hemisphere fusiform gyrus is more often involved in familiar face recognition than the left. It remains unclear whether the fusiform gyrus is only specific for the recognition of human faces or if it is also involved in highly trained visual stimuli. There are two types of prosopagnosia: acquired and congenital (developmental). Acquired prosopagnosia results from occipito-temporal lobe damage and is most often found in adults. This is further subdivided into apperceptive and associative prosopagnosia. In congenital prosopagnosia, the individual never adequately develops the ability to recognize faces. Though there have been several attempts at remediation, no therapies have demonstrated lasting real-world improvements across a group of prosopagnosics. Prosopagnosics often learn to use ""piecemeal"" or ""feature-by-feature"" recognition strategies. This may involve secondary clues such as clothing, gait, hair color, skin color, body shape, and voice. Because the face seems to function as an important identifying feature in memory, it can also be difficult for people with this condition to keep track of information about people, and socialize normally with others. Prosopagnosia has also been associated with other disorders that are associated with nearby brain areas: left hemianopsia (loss of vision from left side of space, associated with damage to the right occipital lobe), achromatopsia (a deficit in color perception often associated with unilateral or bilateral lesions in the temporo-occipital junction) and topographical disorientation (a loss of environmental familiarity and difficulties in using landmarks, associated with lesions in the posterior part of the parahippocampal gyrus and anterior part of the lingual gyrus of the right hemisphere)."
"http://dbpedia.org/resource/Face_Recognition_Grand_Challenge"	"Face Recognition Grand Challenge"	"Face recognition"	"The Face Recognition Grand Challenge (FRGC) was conducted in an effort to promote and advance face recognition technology. It was the successor of the Face Recognition Vendor Test."
"http://dbpedia.org/resource/Multiple_Biometric_Grand_Challenge"	"Multiple Biometric Grand Challenge"	"Face recognition"	"Multiple Biometric Grand Challenge (MBGC) is a biometric project."
"http://dbpedia.org/resource/FERET_(facial_recognition_technology)"	"FERET (facial recognition technology)"	"Face recognition"	"The Facial Recognition Technology (FERET) program was sponsored by The US Department of Defense (DoD) Counterdrug Technology Development Program Office. The goal of the FERET program was to develop automatic face recognition capabilities that could be employed to assist security, intelligence, and law enforcement personnel in the performance of their duties. The program consisted of three major elements: 
* Sponsoring research 
* Collecting the FERET database 
* Performing the FERET evaluations The goal of the sponsored research was to develop face recognition algorithms. The FERET database was collected to support the sponsored research and the FERET evaluations. The FERET evaluations were performed to measure progress in algorithm development and identify future research directions."
"http://dbpedia.org/resource/Face.com"	"Face.com"	"Face recognition"	"Face.com was a Tel Aviv-based technology company that developed a platform for efficient and accurate facial recognition in photos uploaded via web and mobile applications. Face.com apps and API services scanned billions of photos monthly and tagged faces in those photos, tying them to social networking information. As of February 2011, the company had “discovered” 18 billion faces across its API and Facebook applications. The company was established in 2009, and maintained an office in Tel Aviv, Israel with 10 employees. Face.com developed and released two Facebook applications: Photo Finder and Photo Tagger. Photo Finder allowed users to find untagged pictures of themselves as well as friends on Facebook and then tag those photos. Photo Tagger enabled bulk-tagging of faces that appear in multiple photos uploaded to the Facebook website. On June 18, 2012, the company announced that it has been acquired by Facebook. It was also announced that they were winding up their API's to focus on new Facebook products."
"http://dbpedia.org/resource/Viewdle"	"Viewdle"	"Face recognition"	"Viewdle is a Ukrainian facial recognition company. Google was reportedly close to closing a deal to buy the company for between $30 to $45 million in October 2012."
"http://dbpedia.org/resource/Cascade_Learning_Based_on_Adaboost"	"Cascade Learning Based on Adaboost"	"Face recognition"	"The Boosting Algorithms for Detector Cascade Learning is proposed by Mohammad Saberian and Nuno Vasconcelos in 2014, it is based on Viola–Jones object detection framework."
"http://dbpedia.org/resource/Covert_facial_recognition"	"Covert facial recognition"	"Face recognition"	"Joachim Bodamer created the term prosopagnosia in 1947, which is a disorder where individuals have an inability to recognize faces of people. Individuals with this disorder do not have the ability to overtly recognize faces, but discoveries have been made showing that people with this disorder have the ability to covertly recognize faces. Covert facial recognition is the unconscious recognition of familiar faces by people with prosopagnosia. The individuals who express this phenomenon are unaware that they are recognizing the faces of people they have seen before. There are two types of prosopagnosia, congenital and acquired. Congential prosopagnosia is an inability to recognize faces without a history of brain damage; while acquired prosopagnosia is caused by damage to the right occipital-temporal region of the brain. In the 1950s it was theorized that the right cerebral hemisphere was involved in facial recognition and in the 1960s this theory was supported by many experiments. Although the ability for overt facial recognition is inhibited in patients with prosopagnosia, there have been many studies done which show that some of these individuals may have the ability to recognize familiar faces covertly. These experiments have used behavioral and physiological measures in order to demonstrate covert facial recognition. A common physiological measure that is used is the measure of autonomic activity by using skin-conductance responses (SCR) which show a larger response in individuals with prosopagnosia who are shown pictures of familiar faces compared to pictures of unfamiliar faces."
"http://dbpedia.org/resource/Super_recogniser"	"Super recogniser"	"Face recognition"	"Super recognisers are people with extraordinary good face recognition ability. It is the extreme opposite of prosopagnosia. It is estimated that 1–2% of population are super recognisers who can remember 80% of faces they have seen. Normal people can only remember about 20% of faces. They have proved to be far superior to computer recognition systems. The science behind this is poorly understood but may be related to the fusiform face area part of the brain. In May 2015, the Metropolitan Police officially formed a team made up of people with a ""superpower"" for recognising people and put them to work identifying crooks whose faces are captured on CCTV. Scotland Yard has a squad of over 200 super recognisers."
"http://dbpedia.org/resource/People_Staring_at_Computers"	"People Staring at Computers"	"Face recognition"	"People Staring at Computers is an art project and Tumblr Blog created by Kyle McDonald in June 2011. McDonald traveled to two Apple Store locations in New York City; one on West 14th Street and one on SoHo Street. Each Apple Store contains about 50 desktop and laptop computers, half of which were used for the project after installing an application. The application was created by McDonald and took one picture from the Apple Store’s computer webcam every minute. This application also included face recognition, allowing the computer to take a picture only if a face was detected in front of the webcam. Apple Stores routinely clear their computer servers every night so each day McDonald had to reinstall the program. McDonald would also take video of the customer’s reactions once the picture was taken. The project was complete after three days and in total collected over a thousand photographs of Apple Store customers."
"http://dbpedia.org/resource/Face_superiority_effect"	"Face superiority effect"	"Face recognition"	"In psychology, the face superiority effect refers to the phenomena of how human faces are perceived and encoded in memory. Rather than perceiving and encoding individual features of a face (nose, eyes etc.), we perceive and encode a human face as a ""holistic"" unified whole. This phenomena aids our visual system in the recognition of thousands of faces, a task that would be difficult if it were necessary to recognize a set of individual features and characteristics. This effect is limited to the perception of upright faces and does not occur when face is in an unusual angle. A 1967 study presented paired images of faces to participants. The faces were either both upright, both inverted, or mixed. Then the participants were shown fifteen pairs of photographs and asked to decide which one they had seen. The participants remembered the upright faces more than the inverted faces."
"http://dbpedia.org/resource/Face_space"	"Face space"	"Face recognition"	"Face space is a theoretical idea in psychology such that it is a multidimensional space in which recognisable faces are stored. The representation of faces within this space are according to invariant features of the face itself. However, recently was theoretically demonstrated that faces can be stored in the face space according to their dynamic features as well, and that in this case the resulting space exhibits a twofold structure. The face space is useful for accounting various aspects of face recognition including distinctiveness, the own race bias  and caricature effects. The face space framework has been cited in almost 1000 scientific articles and it was recently revisited in a special edition of the journal Quarterly Journal of Experimental Psychology featuring the top 10 ideas that have appeared in the journal's pages."
"http://dbpedia.org/resource/Prosopometamorphopsia"	"Prosopometamorphopsia"	"Face recognition"	"Prosopometamorphopsia is a rare visual perceptual distortion resulting in an altered perception of faces. It is distinct from prosopagnosia which is characterised by the inability to recognise faces and it relatively more common."
"http://dbpedia.org/resource/ViBe"	"ViBe"	"Computer vision"	"ViBe is a background subtraction algorithm which has been presented at the IEEE ICASSP 2009 conference and was refined in later publications. More precisely, it is a software module for extracting background information from moving images. It has been developed by Oliver Barnich and Marc Van Droogenbroeck of the Montefiore Institute, University of Liège, Belgium. ViBe is patented: the patent covers various aspects such as stochastic replacement, spatial diffusion, and non-chronological handling. ViBe is written in the programming language C, and has been implemented on CPU, GPU and FPGA."
"http://dbpedia.org/resource/Intrinsic_dimension"	"Intrinsic dimension"	"Computer vision"	"In signal processing of multidimensional signals, for example in computer vision, the intrinsic dimension of the signal describes how many variables are needed to represent the signal. For a signal of N variables, its intrinsic dimension M satisfies 0 ≤ M ≤ N. Usually the intrinsic dimension of a signal relates to variables defined in a Cartesian coordinate system. In general, however, it is also possible to describe the concept for non-Cartesian coordinates, for example, using polar coordinates."
"http://dbpedia.org/resource/Machine_vision"	"Machine vision"	"Computer vision"	"Machine vision (MV) is the technology and methods used to provide imaging-based automatic inspection and analysis for such applications as automatic inspection, process control, and robot guidance in industry. The scope of MV is broad. MV is related to, though distinct from, computer vision."
"http://dbpedia.org/resource/Visual_descriptor"	"Visual descriptor"	"Computer vision"	"In computer vision, visual descriptors or image descriptors are descriptions of the visual features of the contents in images, videos, or algorithms or applications that produce such descriptions. They describe elementary characteristics such as the shape, the color, the texture or the motion, among others."
"http://dbpedia.org/resource/Multi-scale_approaches"	"Multi-scale approaches"	"Computer vision"	"The scale space representation of a signal obtained by Gaussian smoothing satisfies a number of special properties, scale-space axioms, which make it into a special form of multi-scale representation. There are, however, also other types of ""multi-scale approaches"" in the areas of computer vision, image processing and signal processing, in particular the notion of wavelets. The purpose of this article is to describe a few of these approaches:"
"http://dbpedia.org/resource/Scale-space_axioms"	"Scale-space axioms"	"Computer vision"	"In image processing and computer vision, a scale space framework can be used to represent an image as a family of gradually smoothed images. This framework is very general and a variety of scale space representations exist. A typical approach for choosing a particular type of scale space representation is to establish a set of scale-space axioms, describing basic properties of the desired scale-space representation and often chosen so as to make the representation useful in practical applications. Once established, the axioms narrow the possible scale-space representations to a smaller class, typically with only a few free parameters. A set of standard scale space axioms, discussed below, leads to the linear Gaussian scale-space, which is the most common type of scale space used in image processing and computer vision."
"http://dbpedia.org/resource/Scale_space_implementation"	"Scale space implementation"	"Computer vision"	"The linear scale-space representation of an N-dimensional continuous signal, is obtained by convolving fC with an N-dimensional Gaussian kernel: In other words: However, for implementation, this definition is impractical, since it is continuous. When applying the scale space concept to a discrete signal fD, different approaches can be taken. This article is a brief summary of some of the most frequently used methods."
"http://dbpedia.org/resource/Stereo_cameras"	"Stereo cameras"	"Computer vision"	"The stereo cameras approach is a method of distilling a noisy video signal into a coherent data set that a computer can begin to process into actionable symbolic objects, or abstractions. Stereo cameras is one of many approaches used in the broader fields of computer vision and machine vision."
