"tech"	"callret-1"	"callret-2"	"callret-3"
"http://dbpedia.org/resource/List_of_programming_languages_for_artificial_intelligence"	"List of programming languages for artificial intelligence"	"Artificial intelligence"	"Artificial intelligence researchers have developed several specialized programming languages for artificial intelligence:"
"http://dbpedia.org/resource/Cognitive_computer"	"Cognitive computer"	"Artificial intelligence"	"A cognitive computer combines artificial intelligence and machine-learning algorithms, in an approach which attempts to reproduce the behaviour of the human brain. An example is provided by the IBM company's Watson machine. A subsequent development by IBM is the TrueNorth microchip architecture, which is designed to be closer in structure to the human brain that the von Neumann architecture used in conventional computers. The IBM cognitive computers implement learning using Hebbian theory. Instead of being programmable in a traditional sense within machine language or a higher level programming language such a device learns by inputting instances through an input device that are aggregated within a computational convolution or neural network architecture consisting of weights within a parallel memory system. An early instantiation of such a device has been developed in 2012 under the Darpa SyNAPSE program at IBM directed by Dharmendra Modha."
"http://dbpedia.org/resource/Kuwahara_filter"	"Kuwahara filter"	"Artificial intelligence"	"Suppose that is a grey scale image and that we take a square window of size centered around a point in the image. This square can be divided into four smaller square regions each of which will be where is the cartesian product. It must be noted that pixels located on the borders between two regions belong to both regions so there is a slight overlap between subregions. The arithmetic mean and standard deviation of the four regions centered around a pixel (x,y) are calculated and used to determine the value of the central pixel. The output of the kuwahara filter for any point is then given by This means that the central pixel will take the mean value of the area that is most homogenous. The location of the pixel in relation to an edge plays a great role in determining which region will have the greater standard deviation. If for example the pixel is located on a dark side of an edge it will most probably take the mean value of the dark region. On the other hand, should the pixel be on the lighter side of an edge it will most probably take a light value. On the event that the pixel is located on the edge it will take the value of the more smooth, least textured region. The fact that the filter takes into account the homogeneity of the regions ensures that it will preserve the edges while using the mean creates the blurring effect. Similarly to the Median filter the Kuwahara filter uses a sliding window approach to access every pixel in the image. The size of the window is chosen in advance and may vary depending on the desired level of blur in the final image. Bigger windows typically result in the creation of more abstract images whereas small windows produce images that retain their detail. Typically windows are chose to be square with sides that have an odd number of pixels for symmetry. However, there are variations of the Kuwahara filter that use rectangular windows. Additionally, the subregions do not need to overlap or have the same size as long as they cover all of the window."
"http://dbpedia.org/resource/Puckstering"	"Puckstering"	"Artificial intelligence"	"Puckstering is a term used in gaming that refers to an operator controlling a group of AI entities. For example, a gamer playing the role of an army platoon sergeant could control a platoon of soldiers. He could command them to attack an enemy, which they would do autonomously. This is referred to as ""puckstering."""
"http://dbpedia.org/resource/Cloud_robotics"	"Cloud robotics"	"Artificial intelligence"	"Cloud robotics is a field of robotics that attempts to invoke cloud technologies such as cloud computing, cloud storage, and other Internet technologies centred on the benefits of converged infrastructure and shared services for robotics. When connected to the cloud, robots can benefit from the powerful computational, storage, and communications resources of modern data centre in the cloud, which can process and share information from various robots or agent (other machines, smart objects, humans, etc.). Humans can also delegate tasks to robots remotely through networks. Cloud computing technologies enable robot systems to be endowed with powerful capability whilst reducing costs through cloud technologies. Thus, it is possible to build lightweight, low cost, smarter robots have intelligent ""brain"" in the cloud. The ""brain"" consists of data center, knowledge base, task planners, deep learning, information processing, environment models, communication support etc."
"http://dbpedia.org/resource/Any-angle_path_planning"	"Any-angle path planning"	"Artificial intelligence"	"Any-angle path planning algorithms search for paths on a cell decomposition of a continuous configuration space (such as a two-dimensional terrain)."
"http://dbpedia.org/resource/Artificial_intelligence,_situated_approach"	"Artificial intelligence, situated approach"	"Artificial intelligence"	"In artificial intelligence research, the situated approach builds agents that are designed to behave effectively successfully in their environment. This requires designing AI ""from the bottom-up"" by focussing on the basic perceptual and motor skills required to survive. The situated approach gives a much lower priority to abstract reasoning or problem-solving skills. The approach was originally proposed as an alternative to traditional approaches (that is, approaches popular before 1985 or so).After several decades, classical AI technologies started to face intractable issues (e.g. combinatorial explosion) when confronted with real-world modeling problems. All approaches to address these issues focus on modeling intelligences situated in an environment. They have become known as the situated approach to AI."
"http://dbpedia.org/resource/Artificial_intuition"	"Artificial intuition"	"Artificial intelligence"	"Artificial intuition is the capacity of an artificial object or software to function with the factor of consciousness known as intuition, or a machine-based system that has some capacity to function analogous to human intuition."
"http://dbpedia.org/resource/Automated_personal_assistant"	"Automated personal assistant"	"Artificial intelligence"	"An automated personal assistant or an Intelligent Personal Assistant is a mobile software agent that can perform tasks, or services, on behalf of an individual based on a combination of user input, location awareness, and the ability to access information from a variety of online sources (such as weather conditions, traffic congestion, news, stock prices, user schedules, retail prices, etc.). There are two types of automated personal assistants: intelligent automated assistants (for example, Apple’s Siri and Tronton’s Cluzee), which perform concierge-type tasks (e.g., making dinner reservations, purchasing event tickets, making travel arrangements) or provide information based on voice input or commands; and smart personal agents, which automatically perform management or data-handling tasks based on online information and events often without user initiation or interaction. According to Chi-Hua Chien of Kleiner Perkins Caufield & Byers, examples of tasks that may be performed by a smart personal agent-type of automated personal assistant include schedule management (e.g., sending an alert to a dinner date that a user is running late due to traffic conditions, update schedules for both parties, and change the restaurant reservation time) and personal health management (e.g., monitoring caloric intake, heart rate and exercise regimen, then making recommendations for healthy choices). Both types of automated personal assistant technology are enabled by the combination of mobile computing devices, application programming interfaces (APIs), and the proliferation of mobile apps. However, intelligent automated assistants are designed to perform specific, one-off tasks specified by user voice instructions, while smart personal agents perform ongoing tasks (e.g., schedule management) autonomously."
"http://dbpedia.org/resource/Type-1_OWA_operators"	"Type-1 OWA operators"	"Artificial intelligence"	"The Yager's OWA (ordered weighted averaging) operators are used to aggregate the crisp values in decision making schemes (such as multi-criteria decision making, multi-expert decision making and multi-criteria/multi-expert decision making). It is widely accepted that Fuzzy sets are more suitable for representing preferences of criteria in decision making. The type-1 OWA operators have been proposed for this purpose. The type-1 OWA operators provides a technique for directly aggregating uncertain information with uncertain weights via OWA mechanism in soft decision making and data mining, where these uncertain objects are modelled by fuzzy sets. The two definitions for type-1 OWA operators are based on Zadeh's Extension Principle and -cuts of fuzzy sets. The two definitions lead to equivalent results."
"http://dbpedia.org/resource/Artificial_intelligence_and_law"	"Artificial intelligence and law"	"Artificial intelligence"	"Artificial intelligence and law (AI and law) is a subfield of artificial intelligence (AI) mainly concerned with applications of AI to legal informatics problems and original research on those problems. It is also concerned to contribute in the other direction: to export tools and techniques developed in the context of legal problems to AI in general. For example, theories of legal decision making, especially models of argumentation, have contributed to knowledge representation and reasoning; models of social organization based on norms have contributed to multi-agent systems; reasoning with legal cases has contributed to case-based reasoning; and the need to store and retrieve large amounts of textual data has resulted in contributions to conceptual information retrieval and intelligent databases."
"http://dbpedia.org/resource/Attributional_calculus"	"Attributional calculus"	"Artificial intelligence"	"Attributional calculus is a logic and representation system defined by Ryszard S. Michalski. It combines elements of predicate logic, propositional calculus, and multi-valued logic. Attributional calculus provides a formal language for natural induction, an inductive learning process whose results are in forms natural to people."
"http://dbpedia.org/resource/Agent_systems_reference_model"	"Agent systems reference model"	"Artificial intelligence"	"The agent systems reference model (ASRM) is a layered, abstract description for multiagent systems. As such, the reference model 
*  provides a taxonomy of terms, concepts and definitions to compare agent systems; 
*  identifies functional elements that are common in agent systems; 
*  captures data flow and dependencies among the functional elements in agent systems; and 
*  specifies assumptions and requirements regarding the dependencies among these elements. The ASRM differentiates itself from technical standards, such as Knowledge Interchange Format, Knowledge Query and Manipulation Language, and those of the Foundation for Intelligent Physical Agents in that it defines the required existence of components of a multiagent system; standards prescribe how they are designed."
"http://dbpedia.org/resource/Intelligent_decision_support_system"	"Intelligent decision support system"	"Artificial intelligence"	"An intelligent decision support system (IDSS) is a decision support system that makes extensive use of artificial intelligence (AI) techniques. Use of AI techniques in management information systems has a long history, indeed terms such as Knowledge-based systems (KBS) and intelligent systems have been used since the early 1980s to describe components of management systems, but the term ""Intelligent decision support system"" is thought to originate with Clyde Holsapple and Andrew Whinston in the late 1970s. Examples of specialized intelligent decision support systems include Flexible manufacturing systems (FMS), intelligent marketing decision support systems and medical diagnosis systems. Ideally, an intelligent decision support system should behave like a human consultant: supporting decision makers by gathering and analysing evidence, identifying and diagnosing problems, proposing possible courses of action and evaluating the proposed actions. The aim of the AI techniques embedded in an intelligent decision support system is to enable these tasks to be performed by a computer, while emulating human capabilities as closely as possible. Many IDSS implementations are based on expert systems, a well established type of KBS that encode knowledge and emulate the cognitive behaviours of human experts using predicate logic rules, and have been shown to perform better than the original human experts in some circumstances. Expert systems emerged as practical applications in the 1980s  based on research in artificial intelligence performed during the late 1960s and early 1970s. They typically combine knowledge of a particular application domain with an inference capability to enable the system to propose decisions or diagnoses. Accuracy and consistency can be comparable to (or even exceed) that of human experts when the decision parameters are well known (e.g. if a common disease is being diagnosed), but performance can be poor when novel or uncertain circumstances arise. Some research in AI, focused on enabling systems to respond to novelty and uncertainty in more flexible ways is starting to be used in intelligent decision support systems. For example, intelligent agents that perform complex cognitive tasks without any need for human intervention have been used in a range of decision support applications. Capabilities of these intelligent agents include knowledge sharing, machine learning, data mining, and automated inference. A range of AI techniques such as case based reasoning, rough sets and fuzzy logic have also been used to enable decision support systems to perform better in uncertain conditions."
"http://dbpedia.org/resource/Music_and_artificial_intelligence"	"Music and artificial intelligence"	"Artificial intelligence"	"Research in artificial intelligence (AI) is known to have impacted medical diagnosis, stock trading, robot control, and several other fields. Perhaps less popular is the contribution of AI in the field of music. Nevertheless, artificial intelligence and music (AIM) has, for a long time, been a common subject in several conferences and workshops, including the International Computer Music Conference, the Computing Society Conference  and the International Joint Conference on Artificial Intelligence. In fact, the first International Computer Music Conference was the ICMC 1974, Michigan State University, East Lansing, USA Current research includes the application of AI in music composition, performance, theory and digital sound processing. Several music software applications have been developed that use AI to produce music. A few examples are included below. Note that there are many that are still being developed."
"http://dbpedia.org/resource/Gödel_machine"	"Gödel machine"	"Artificial intelligence"	"A Gödel machine is a self-improving computer program that solves problems in an optimal way. It uses a recursive self-improvement protocol in which it rewrites its own code when it can prove the new code provides a more optimal strategy. The machine was invented by Jürgen Schmidhuber (first proposed in 2003), but is named after Kurt Gödel who inspired the mathematical theories. The Gödel machine is often discussed when dealing with issues of meta-learning, also known as ""learning to learn."" Applications include automating human design decisions and transfer of knowledge between multiple related tasks, and may lead to design of more robust and general learning architectures. Though theoretically possible, no full implementation has existed before. The Gödel machine is often compared with Marcus Hutter's AIXI, another formal specification for an artificial general intelligence. Schmidhuber points out that the Gödel machine could start out by implementing AIXI as its initial sub-program, and self-modify after it finds proof that another algorithm for its search code will be more optimal."
"http://dbpedia.org/resource/Legal_expert_system"	"Legal expert system"	"Artificial intelligence"	"A legal expert system is a domain-specific expert system that uses artificial intelligence to emulate the decision-making abilities of a human expert in the field of law. Legal expert systems employ a rule base or knowledge base and an inference engine to accumulate, reference and produce expert knowledge on specific subjects within the legal domain."
"http://dbpedia.org/resource/Trenchard_More"	"Trenchard More"	"Artificial intelligence"	"Trenchard More is a professor at Dartmouth College. He participated in the 1956 Dartmouth Summer Research Project on Artificial Intelligence. At the 50th year meeting of the Dartmouth Conference with Marvin Minsky, Geoffrey Hinton and Simon Osindero he presented The Future of Network Models and also gave a lecture entitled Routes to the Summit. Designed a theory for nested rectangular array that provided a formal structure used in the development of the  Nested Interactive Array Language."
"http://dbpedia.org/resource/Catastrophic_interference"	"Catastrophic interference"	"Artificial intelligence"	"Catastrophic interference, also known as catastrophic forgetting, is the tendency of an artificial neural network to completely and abruptly forget previously learned information upon learning new information. Neural networks are an important part of the network approach and connectionist approach to cognitive science. These networks use computer simulations to try and model human behaviours, such as memory and learning. Catastrophic interference is an important issue to consider when creating connectionist models of memory. It was originally brought to the attention of the scientific community by research from McCloskey and Cohen (1989), and Ractcliff (1990). It is a radical manifestation of the ‘sensitivity-stability’ dilemma  or the ‘stability-plasticity’ dilemma. Specifically, these problems refer to the issue of being able to make an artificial neural network that is sensitive to, but not disrupted by, new information. Lookup tables and connectionist networks lie on the opposite sides of the stability plasticity spectrum. The former remains completely stable in the presence of new information but lacks the ability to generalize, i.e. infer general principles, from new inputs. On the other hand, connectionist networks like the standard backpropagation network are very sensitive to new information and can generalize on new inputs. Backpropagation models can be considered good models of human memory insofar as they mirror the human ability to generalize but these networks often exhibit less stability than human memory. Notably, these backpropagation networks are susceptible to catastrophic interference. This is considered an issue when attempting to model human memory because, unlike these networks, humans typically do not show catastrophic forgetting. Thus, the issue of catastrophic interference must be eradicated from these backpropagation models in order to enhance the plausibility as models of human memory."
"http://dbpedia.org/resource/AI_box"	"AI box"	"Artificial intelligence"	"An AI box is a hypothetical isolated computer hardware system where a possibly dangerous artificial intelligence, or AI, is kept constrained in a ""virtual prison"" and not allowed to manipulate events in the external world. Such a box would be restricted to minimalist communication channels. Unfortunately, even if the box is well-designed, a sufficiently intelligent AI may nevertheless be able to persuade or trick its human keepers into releasing it, or otherwise be able to ""hack"" its way out of the box."
"http://dbpedia.org/resource/Deepdreaming"	"Deepdreaming"	"Artificial intelligence"	"Deep dreaming refers to the generation of images that desired activations in a trained deep network.For example, given a network that is trained to recognize cats (among other things), a dreamed cat image can be synthesized by performing a Gradient descent optimization adjusting a random image such that when it is fed forward through the trained network, it produces the ""this is a cat"" output.The optimization resembles Backpropagation, however instead of adjusting the network weights,the weights are held fixed and the input is adjusted. Alternately, an existing image can be altered so that it is more cat-like,and the resulting enhanced image can be again input to the procedure.This usage resembles the childhood activity of looking for animals or other patterns in clouds. The dreaming idea and name became popular on the internet in 2015 thanks to Google's DeepDream program. The idea dates from early in the history of neural networks , and was explored more recently (but prior to Google's work) by several research groups. Applying gradient descent independently to each pixel of the input produces images in whichadjacent pixels have little relation and thus the image has too much high frequency information.The generated images can be greatly improved by including a prior or regularizer that prefers inputsthat have natural image statistics (without a preference for any particular image), or are simply smooth.For example, used the total variation regularizer that prefers images that are piecewise constant. Various regularizers are discussed further in. The dreaming idea can be applied to hidden (internal) neurons other than those in the output, which allows exploration of the roles and representations of various parts of the network.It is also possible to optimize the input to satisfy either a single neuron (this usage is sometimes called Activity Maximization) or an entire layer of neurons. While dreaming is most often used for visualizing networks or producing computer art, it has recently been proposed that adding ""dreamed"" inputs to the training set can improve training times."
"http://dbpedia.org/resource/Language_Acquisition_Device_(computer)"	"Language Acquisition Device (computer)"	"Artificial intelligence"	"The Language Acquisition Device is a computer program developed by Lobal Technologies, a computer company in the United Kingdom, and scientists from King's College. It emulates the functions of the brain's frontal lobes where humans process language and emotion. Scientists hope this might enable computers to understand, speak, learn, and eventually think. One possible use is in interactive entertainment such as video gaming, where the technology is used to help computer-controlled characters to develop. A press release describing this technology produced widespread media interest in 2002, but no reports have been published since then, and the current status of the technology is unclear."
"http://dbpedia.org/resource/Evolving_intelligent_system"	"Evolving intelligent system"	"Artificial intelligence"	"The term Evolving Intelligent Systems (EIS) was coined in 2005 by Angelov and Kasabov, to define the new approach which focuses on learning, developing soft computing models that have both their parameters but also their structure adapting on-line. The first papers in this direction can be traced back to the end of 20th century, but these were closer to evolutionary algorithms. Later, in the very beginning of the 21st century both Angelov and Kasabov came independently to evolving rule-based, and evolving connectionist systems  concepts respectively. This was followed later by a large number of research works by various authors, etc. who meet annually at IEEE sponsored conferences on this topic. EIS are usually associated with, streaming data and on-line (often real-time) modes of operation. They can be seen as adaptive intelligent systems with low-computational complexity. EIS assumes on-line adaptation of system structure in addition to the parameter adaptation which is usually associated with the term ""incremental"" from Incremental heuristic search. Due to the implementation of a wide variety of adaptive, evolving and dynamic methodologies, they represent an important cornerstone within the field of data-driven learning in non-stationary environments An important sub-area of EIS is represented by Evolving Fuzzy Systems (EFS) (a comprehensive survey including real-world applications can be found in ), which rely on fuzzy systems architecture and incrementally update, evolve and prune fuzzy sets and fuzzy rules on demand and on-the-fly.One of the major strengths of EFS, compared to other forms of evolving system models, is that they are able to support some sort of interpretability and understandability for experts and users. This opens possibilities for enriched human-machine interaction's scenarios, where the users may ""communicate"" with an on-line evolving system in form of knowledge exchange (active learning (machine learning) and teaching). This concept is currently motivated and discussed in the evolving systems community under the term Human-Inspired Evolving Machines and respected as ""one future"" generation of ""EIS""."
